<layers-configuration xmlns="http://www.springframework.org/schema/boot/layers"
					  xmlns:xsi="http://www.w3.org/2001/XMLSchema-instance"
					  xsi:schemaLocation="http://www.springframework.org/schema/boot/layers
					  https://www.springframework.org/schema/layers/layers-configuration.xsd">
	<layers>
		<layer>configuration</layer>
		<layer>application</layer>
		<layer>snapshot-dependencies</layer>
		<layer>my-dependencies-name</layer>
	</layers>
	<libraries>
		<layer-content layer="snapshot-dependencies">
			<coordinates>
				<include>*:*:*-SNAPSHOT</include>
			</coordinates>
		</layer-content>
		<layer-content layer="my-dependencies-name">
			<coordinates>
				<include>*:*:*</include>
			</coordinates>
		</layer-content>
	</libraries>
	<classes>
		<layer-content layer="configuration">
			<locations>
				<include>**/application*.*</include>
			</locations>
		</layer-content>
		<layer-content layer="application">
			<locations>
				<include>**</include>
			</locations>
		</layer-content>
	</classes>
</layers-configuration>